{
  "case_id": "case_02",
  "transcription_cleaned": "Doctor: Good morning, sir. I'm Dr. Smith. How can I help you today?\nPatient: Good morning, doctor. I came here to report my diabetes.\nDoctor: I see. Can you tell me more about your diagnosis?\nPatient: Yes, I was diagnosed with type 2 diabetes mellitus when I was 25 years old.\nDoctor: I see. And what is your prior medical history?\nPatient: Well, I had a dilated cardiomyopathy and was treated with a pacemaker when I was 42.\nDoctor: Hmm, I see. And what about your family history?\nPatient: My mother and maternal grandfather had type 2 diabetes, but my father died of natural causes and wasn't affected by diabetes. My brother and sister are healthy and don't have any signs of hyperglycaemia.\nDoctor: Are you experiencing any diabetic complications such as nephropathy, neuropathy, or retinopathy?\nPatient: No, I'm not experiencing any of those complications.\nDoctor: Okay, that's good to hear. And have you been experiencing any diabetic symptoms recently?\nPatient: No, I haven't experienced any symptoms.\nDoctor: I see. And what treatment have you been following for your diabetes?\nPatient: I've been following a regular treatment with basal-bolus insulin and metformin.\nDoctor: Okay, I understand. And have you had any tests done to detect insulin resistance?\nPatient: No, I haven't had any tests done for that.\nDoctor: I see. Well, we'll need to schedule an examination for you to monitor your blood glucose levels. Can you keep a diary of your morning and pre-meal levels?\nPatient: Sure, I can do that.\nDoctor: Great. And we'll also need to detect beta-cell antibodies to investigate the possibility of an autoimmune etiology of your diabetes.\nPatient: Okay, I understand.\nDoctor: Good morning, sir. How are you today?\nPatient: Good morning, doctor. I'm doing well.\nDoctor: Great to hear. And have you been monitoring your blood glucose levels?\nPatient: Yes, I have.\nDoctor: Okay, let's take a look at the results. I see that your blood test results were not significant for autoimmune diabetes. And your capillary blood glucose levels showed an acceptable trend for diabetes.\nPatient: Okay.\nDoctor: So, based on the reasonable glycemic control, we'll modify your treatment plan.\nPatient: Okay, I understand.\nDoctor: Great. I'll see you in another month for a follow-up appointment.\nPatient: Okay, thank you, doctor.",
  "clinical_summary": "The patient is a 48-year-old male with a history of type 2 diabetes mellitus diagnosed at age 25, dilated cardiomyopathy, and a pacemaker implanted at age 42. He has a family history of type 2 diabetes on his maternal side. The patient was initially on basal-bolus insulin and metformin but experienced poor glycemic control. Genetic testing revealed a NEUROD1 mutation (MODY6), leading to treatment adjustments. Current medications include insulin glargine, metformin, and gliclazide, with improved glycemic control and no diabetic complications reported.",
  "differential_diagnosis": [
    {
      "condition": "Type 2 Diabetes Mellitus",
      "pmid": null,
      "rationale": "The patient has a long-standing diagnosis of type 2 diabetes mellitus, supported by family history and clinical presentation."
    },
    {
      "condition": "MODY6 (NEUROD1 mutation)",
      "pmid": null,
      "rationale": "Genetic testing confirmed a NEUROD1 mutation, consistent with MODY6, which affects insulin secretion and glycemic control."
    },
    {
      "condition": "Dilated Cardiomyopathy",
      "pmid": null,
      "rationale": "The patient has a history of dilated cardiomyopathy, which is managed with a pacemaker and is relevant to his overall health status."
    }
  ],
  "normalized_medications": [
    {
      "original": "insulin glargine daily",
      "rxnorm_id": null,
      "ingredient": "insulin glargine"
    },
    {
      "original": "metformin 500mg three times daily",
      "rxnorm_id": null,
      "ingredient": "metformin"
    },
    {
      "original": "gliclazide 60mg daily",
      "rxnorm_id": null,
      "ingredient": "gliclazide"
    }
  ],
  "drug_interactions": [],
  "final_report": {
    "subjective": "The patient is a 48-year-old male with a history of type 2 diabetes mellitus, dilated cardiomyopathy, and a pacemaker. He reports no diabetic complications or symptoms and follows a treatment regimen of insulin glargine, metformin, and gliclazide.",
    "objective": "The patient's blood glucose levels are within an acceptable range (90-130 mg/dL), and there are no significant findings for autoimmune diabetes. Genetic testing revealed a NEUROD1 mutation (MODY6).",
    "assessment": "The patient has type 2 diabetes mellitus with a NEUROD1 mutation (MODY6), leading to adjustments in his treatment plan. Glycemic control has improved with the current regimen, and there are no diabetic complications.",
    "plan": "Continue current medications: insulin glargine, metformin, and gliclazide. Monitor blood glucose levels regularly. Schedule follow-up in one month to reassess glycemic control and adjust treatment as necessary."
  }
}