{
  "case_id": "case_01_template",
  "transcription_cleaned": "Doctor: Hello, how can I help you today?  \nPatient: I have complaints of persistent right cheek pain.  \nDoctor: Okay, let's take a look at your history. Was there anything unusual about your medical history?  \nPatient: I have allergic rhinitis and chronic sinusitis that had been treated until 3 months previously by an otolaryngologist.  \nDoctor: I see. And what about your family history? Anything to note?  \nPatient: Yes, my father had severe hearing impairment.  \nDoctor: Thank you for letting me know. When did your symptoms start?  \nPatient: I had high fever, sore throat, and comorbid right cheek pain and mild swelling 6 weeks previously.  \nDoctor: Did you visit a dental clinic at any point?  \nPatient: Yes, I had a checkup at a dental clinic performed on the day before my initial visit.  \nDoctor: Were there any abnormal findings?  \nPatient: No, there were no abnormal findings.  \nDoctor: After your initial visit, what were you diagnosed with?  \nPatient: I was diagnosed with streptococcal infection.  \nDoctor: I see. And what about facial cellulitis?  \nPatient: Facial cellulitis was also suspected and treatment with amoxicillin helped improve symptoms.  \nDoctor: Did the facial pain come back at any point?  \nPatient: Yes, it recurred within 4 weeks of the initial visit.  \nDoctor: And what did you do at that point?  \nPatient: I visited another department and they suspected recurrence of cellulitis with sinusitis and initiated cefditoren pivoxil treatment.  \nDoctor: And did that help with the pain?  \nPatient: No, the pain persisted so I came back for further treatment.  \nDoctor: I see. Based on your physical examination and laboratory tests, you have been clinically diagnosed with TN.  \nPatient: TN?  \nDoctor: Yes, trigeminal neuralgia. We will prescribe you oral clarithromycin to help with the sinusitis that might have caused or exacerbated TN.  \nPatient: Okay, thank you.  \nDoctor: You're welcome. If the clarithromycin doesn't work, we may need to consider other treatment options.",
  "clinical_summary": "An 11-year-old male presents with persistent right cheek pain for 6 weeks, initially associated with high fever and sore throat, and diagnosed as streptococcal pharyngitis with suspected facial cellulitis. Despite treatment with amoxicillin and later cefditoren pivoxil, the pain recurred, leading to a clinical diagnosis of trigeminal neuralgia (TN) and treatment with clarithromycin, which was ineffective. Further evaluation excluded classical TN, and the pain was re-characterized as persistent idiopathic facial pain (PIFP), with psychosocial stressors identified; psychological counseling was initiated, and carbamazepine was trialed but discontinued due to fatigue.",
  "differential_diagnosis": [
    {
      "condition": "Persistent Idiopathic Facial Pain (PIFP)",
      "pmid": null,
      "rationale": "The pain's persistence despite antibiotic treatment, exclusion of classical trigeminal neuralgia, and identification of psychosocial stressors align with PIFP, a diagnosis of exclusion characterized by chronic facial pain without an identifiable cause."
    },
    {
      "condition": "Chronic Sinusitis",
      "pmid": null,
      "rationale": "Given the patient's history of chronic sinusitis and recent cessation of treatment, the persistent cheek pain could be a manifestation of unresolved or recurrent sinusitis, particularly if the pain is localized and pressure-related."
    },
    {
      "condition": "Atypical Facial Pain",
      "pmid": null,
      "rationale": "The atypical presentation and lack of response to typical treatments for trigeminal neuralgia suggest a form of atypical facial pain, which can present with persistent, non-specific facial pain not fitting classical neuralgia patterns."
    }
  ],
  "normalized_medications": [
    {
      "original": "amoxicillin",
      "rxnorm_id": null,
      "ingredient": "amoxicillin"
    },
    {
      "original": "cefditoren pivoxil",
      "rxnorm_id": null,
      "ingredient": "cefditoren"
    },
    {
      "original": "clarithromycin oral",
      "rxnorm_id": null,
      "ingredient": "clarithromycin"
    },
    {
      "original": "carbamazepine 50mg twice daily",
      "rxnorm_id": null,
      "ingredient": "carbamazepine"
    }
  ],
  "drug_interactions": [
    {
      "drug_a": "clarithromycin",
      "drug_b": "carbamazepine",
      "severity": "major",
      "recommendation": "Monitor carbamazepine levels and adjust dose as necessary. Consider alternative antibiotics if possible."
    }
  ],
  "final_report": {
    "subjective": "The patient, an 11-year-old male, presents with persistent right cheek pain that has been ongoing for six weeks. Initially, the pain was associated with a high fever and sore throat, leading to a diagnosis of streptococcal pharyngitis and suspected facial cellulitis. Despite treatment with amoxicillin, the pain recurred four weeks later. The patient reports that the pain is persistent, nagging, and dull, and it has not responded to subsequent treatments, including cefditoren pivoxil and clarithromycin. The patient has a history of allergic rhinitis and chronic sinusitis, which was managed by an otolaryngologist until three months ago. There is a family history of severe hearing impairment in the patient's father. The patient also reports psychosocial stressors, including stalled swim performance, a finger injury, and a strained relationship with his father.",
    "objective": "On physical examination, the patient exhibits tenderness in the right cheek, specifically in the V2 (maxillary nerve) distribution, but there is no hyperalgesia, trigger points, facial palsy, or oral pathology. A head CT scan revealed mild bilateral sinus mucous membrane swelling and effusion, suggesting sinusitis. Blood tests returned normal results. A brain MRI ruled out neurovascular compression, excluding classical trigeminal neuralgia. The patient's pain does not fit the typical pattern of trigeminal neuralgia, as it is persistent and dull rather than sharp and episodic.",
    "assessment": "The clinical presentation and diagnostic findings suggest a diagnosis of Persistent Idiopathic Facial Pain (PIFP), characterized by chronic facial pain without an identifiable cause. This diagnosis is supported by the exclusion of classical trigeminal neuralgia and the presence of psychosocial stressors. Chronic sinusitis remains a consideration due to the patient's history and recent imaging findings, although it does not fully explain the pain's persistence. Atypical facial pain is also considered due to the atypical presentation and lack of response to standard treatments for trigeminal neuralgia.",
    "plan": "The treatment plan includes initiating psychological counseling twice weekly to address identified psychosocial stressors. Pharmacological management with carbamazepine was attempted but discontinued due to fatigue; alternative medications may be considered if necessary. Monitoring for potential drug interactions, particularly between clarithromycin and carbamazepine, is advised. Further evaluation of sinusitis and potential referral to an otolaryngologist may be warranted if symptoms persist. The patient and family will be educated on the nature of PIFP and the importance of addressing psychosocial factors in managing chronic pain."
  }
}